"id","category","name","price","description","example_type","example_content"
"1","listings","CoinGecko","650","Facilitate your token's listing on CoinGecko, a leading cryptocurrency data aggregator, to enhance visibility and credibility among investors and the crypto community.","link","https://www.coingecko.com/"
"2","listings","CoinMarketCap","5700","Assist in listing your token on CoinMarketCap, one of the most referenced crypto asset data aggregators, to increase exposure and attract potential investors.","link","https://coinmarketcap.com/"
"3","trendings","CoinMarketCap - Top 10","6600","Implement strategies to position your token within CoinMarketCap's Top 10 rankings, boosting visibility and investor interest.","link","https://coinmarketcap.com/?type=coins&tableRankBy=trending_24h"
"4","trendings","CoinMarketCap - Most Visited","1000","Enhance your token's profile to appear in CoinMarketCap's Most Visited section, increasing traffic and potential investment.","link","https://coinmarketcap.com/?type=coins&tableRankBy=most_visited_24h"
"6","trendings","CoinGecko - Country Trend","350","Target specific regional markets by promoting your token in CoinGecko's Country Trends, attracting localized investor attention.",,
"7","trendings","CoinGecko - Search","450","Increase your token's prominence by boosting its position in CoinGecko's Search Trends, reflecting growing interest and engagement.","image","attached_assets\\cg-search-trend.png"
"8","trendings","GeckoTerminal - Search","250","Optimize your token's visibility in GeckoTerminal's search results, making it easier for users to discover and track your project.","image","attached_assets\\gt-search.png"
"9","trendings","GeckoTerminal - Pool Trends","300","Promote your token's liquidity pools to appear in GeckoTerminal's trending sections, attracting traders and liquidity providers.","link","https://www.geckoterminal.com/"
"10","trendings","DEXTools - TRENDS","3400","Boost your token's activity to feature in DEXTools' TRENDS, increasing visibility among active traders.","image","attached_assets\\dt-trend.png"
"11","trendings","DEXScreener - Trends","3400","Enhance your token's presence by securing a spot in DEXScreener's Trends, drawing attention from the trading community.","link","https://dexscreener.com/"
"12","trendings","DEXScreener - Update","350","Keep your token's information up-to-date on DEXScreener, ensuring accurate data for potential investors and traders.","image","attached_assets\\dt-socials.png"
"14","trendings","Birdeye - Most Watched","300","Aim to list your token among Birdeye's Most Visited, enhancing exposure to a broader audience.","link","https://birdeye.so/find-gems?chain=all"
"15","trendings","Birdeye - Top Views","300","Strive for your token to be featured in Birdeye's Most Watched list, indicating high interest and engagement.","link","https://birdeye.so/find-gems?chain=all"
"16","trendings","Solscan - Search Trends","600","Promote your token within Solscan's search trends to increase visibility among Solana ecosystem participants.","image","attached_assets\\ss-search.png"
"17","trendings","Crypto.com - Trends","200","Position your token within Crypto.com's Trends to attract attention from a wide user base.","link","https://crypto.com/price/showroom/trending"
"18","trendings","Crypto.com - What Others Are Searching","250","Enhance your token's visibility by appearing in Crypto.com's popular search queries.","image","attached_assets\\crypto-search.png"
"19","trendings","Crypto.com - Most Popular Tokens","250","Aim for your token to be listed among Crypto.com's Most Popular Tokens, signaling strong market interest.","link","https://crypto.com/price/showroom/most-popular"
"21","pr","Binance Article","250","Publish informative and SEO-optimized articles about your token on Binance-affiliated platforms to boost credibility and reach a global audience.","link","https://app.binance.com/uni-qr/cart/23505459559594?r=134529162&l=en-TR&uco=Eyn5inI-Bo9pK6nWv49gxw&uc=app_square_share_link&us=copylink"
"22","pr","CoinMarketCape Article","250","Feature your project in CoinMarketCap articles to provide insight, build legitimacy, and generate interest among retail and institutional users.","link","https://coinmarketcap.com/community/articles/680ec865663d0c01ab12bd13/"
"23","pr","KOL Management","Custom","Manage/Acquire relationships with crypto KOLs (Key Opinion Leaders) across platforms like Twitter, and Telegram to drive engagement and visibility.",,
"24","pr","Shilling","700","Launch targeted 3 day shill campaigns across to generate buzz and grassroots hype around your project. 80+ Expert shillers for maximum visibility - Platforms covered: Telegram | Twitter | YouTube | Instagram | TikTok & more",,
"25","pr","Reddit Campaign (Multiple subreddits and trends)","400","Execute full Reddit campaigns including post creation, subreddit targeting, upvoting, and comment scripting to build viral exposure and trust.","link","https://www.reddit.com/r/CryptoMars/comments/1dt3ef4/uncover_the_feathered_conspiracy_join_the_pigeon/"
"29","pr","Dexscreener Ad – 10k views","280","Promote your token with a DEXScreener ad campaign delivering 10,000 guaranteed views from highly targeted DeFi users.","link","Token Advertising - DEX Screener Marketplace"
"30","pr","Dexscreener Ad – 25k views","650","Promote your token with a DEXScreener ad campaign delivering 25,000 guaranteed views from highly targeted DeFi users.","link","Token Advertising - DEX Screener Marketplace"
"31","pr","Dexscreener Ad – 50k views","925","Promote your token with a DEXScreener ad campaign delivering 50,000 guaranteed views from highly targeted DeFi users.","link","Token Advertising - DEX Screener Marketplace"
"32","pr","Dexscreener Ad – 100k views","1850","Promote your token with a DEXScreener ad campaign delivering 100,000 guaranteed views from highly targeted DeFi users.","link","Token Advertising - DEX Screener Marketplace"
"33","pr","Dexscreener Ad – 200k views","3650","Promote your token with a DEXScreener ad campaign delivering 200,000 guaranteed views from highly targeted DeFi users.","link","Token Advertising - DEX Screener Marketplace"
"34","pr","Dexscreener Ad – 400k views","6500","Promote your token with a DEXScreener ad campaign delivering 400,000 guaranteed views from highly targeted DeFi users.","link","Token Advertising - DEX Screener Marketplace"
"35","pr","Bitcointalk Post w/ Images","180","Create a high-quality, image-rich announcement post on Bitcointalk to establish credibility and generate discussion among long-term crypto investors.","link","https://bitcointalk.org/index.php?topic=5539768.new#new"
"36","dex-boosts","DEXTools - Nitro 200","185","Apply a DEXTools Nitro 200 boost to push your token into trending sections and attract new traders.","image","attached_assets\\dt-nitro.png"
"37","dex-boosts","DEXTools - Nitro 500","475","Apply a DEXTools Nitro 500 boost to increase your token’s chart visibility and social metrics.","image","attached_assets\\dt-nitro.png"
"38","dex-boosts","DEXTools - Nitro 1000","850","Apply a DEXTools Nitro 1000 boost to sustain top-of-chart presence for strong awareness.","image","attached_assets\\dt-nitro.png"
"39","dex-boosts","DEXTools - Nitro 5000","3750","Apply a DEXTools Nitro 5000 boost to dominate DEXTools visibility and maximize inbound traffic from speculative traders.","image","attached_assets\\dt-nitro.png"
"40","dex-boosts","DEXScreener - Boost 30x","235","Activate a 30x Boost on DEXScreener to significantly increase trending score and token exposure.","image","attached_assets\\dx-boosts.png"
"41","dex-boosts","DEXScreener - Boost 50x","380","Activate a 50x Boost on DEXScreener to push your token to the front page of trending charts.","image","attached_assets\\dx-boosts.png"
"42","dex-boosts","DEXScreener - Boost 100x","875","Activate a 100x Boost on DEXScreener to maintain top-of-site visibility for extended periods.","image","attached_assets\\dx-boosts.png"
"43","dex-boosts","DEXScreener - Boost 500x","3800","Activate a 500x Boost on DEXScreener for maximum daily exposure, suitable for launches or major announcements.","image","attached_assets\\dx-boosts.png"
"44","botting","Telegram Reactions","70 per 1000","Deploy Telegram reaction bots to simulate activity and encourage organic community engagement in group chats.","image","attached_assets\\tg-reactions.png"
"45","botting","Twitter Followers","80 per 1000","Use targeted growth methods to increase your project’s Twitter followers and improve brand credibility. All followers are in crypto industry.","link","https://x.com/SpongeSkocka/followers"
"46","botting","DEXTools Community Trust Votes","250 per 1000","Collect Community Trust votes on DEXTools to build legitimacy and improve your token’s ranking and chart presence.","image","attached_assets\\dt-votes.png"
"47","botting","DEX Screener Fire & Rocket Emojis","150 per 1000","Farm Fire and Rocket emojis on DEXScreener to signal hype and drive trader interest through visual cues.","image","attached_assets\\dx-votes.png"
"48","botting","Volume Bot","Custom","Install a real-time Volume Bot in Telegram to showcase ongoing trading activity and boost FOMO during key moments.",,
"49","botting","Bundle Bot","Custom","Add a Bundle Bot that promotes token purchase bundles and supports advanced trading visibility in Telegram groups.","link","https://t.me/TheBundL_bot"
"50","startup","Website","400","Design and launch a custom-built website that communicates your project’s vision, tokenomics, and roadmap.","link","https://thebundlbot.com/"
"51","startup","Logo + Banners","250","Create clean and eye-catching branding assets including logos, banners, and social media kits to unify your identity.","link","https://t.me/BundLContent/4"
"52","startup","Stickers + Emojis","250","Design custom emoji and sticker packs for use in Telegram and Discord to boost engagement and community expression.","link","https://t.me/addstickers/ITOITOonEth"
"53","startup","White Paper/Gitbook","300","Write and publish a professional whitepaper or Gitbook that clearly explains your token’s fundamentals, mechanics, and use case.","link","https://the-bundl-bot.gitbook.io/bundl-bot-docs"
"54","startup","Telegram Setup (with portal + bots)","200","Set up a full-featured Telegram group with portals, bots, pin messages, and anti-spam features for a secure community experience.","link","https://t.me/XMAS6900_Official"
"55","startup","Twitter Setup","200","Create and configure your Twitter profile with optimized bios, banners, and posting schedules to support your marketing goals.","link","https://x.com/XMAS6900_"
"56","startup","Moderation","600","Professional moderation for Telegram and Discord communities to enforce rules, assist users, and keep engagement high. Provides 24/7 support for 1 week, ensuring chats are spam-free, organised, and well-managed.",,
"57","startup","Raiders","700","Raiders to flood social media posts with activity, reactions, comments, and momentum to trigger algorithmic boosts. 20 verified BLUE TICK raiders for 3 days, dedicated to bring the best possible exposure and engagement to your project",,
"58","pr","Audit Fix","400","Eliminate or redice any issues with audits on DEX","image","attached_assets\\audits-fix.png"
"59","startup","Hypers","150","Keep your chat lively and engaging with 10 premium chatters/hypers teams per day. ",,